{
  "year": 1995,
  "detail_level": "summary",
  "status": "final",
  "weeks_available": [],
  "capabilities": {
    "standings": true,
    "advanced_standings": false,
    "matchups": false,
    "schedules": false,
    "rosters": false,
    "player_stats": false,
    "transactions": true,
    "drafts": false,
    "history": true
  }
}
